{
  "schema_version": "ledger-retrieval-suite-v1",
  "suite_id": "dr-5-v1",
  "scenario_id": "anthropic-dod-dispute-v1",
  "seed_path": ".agent/scenarios/anthropic-dod-dispute-v1/ledger-seed-v1.json",
  "query_pack_paths": [
    ".agent/scenarios/anthropic-dod-dispute-v1/queries/dr-5-ledger-v1.jsonl"
  ],
  "required_channels": ["exact", "lexical", "structured_filter"],
  "require_rebuild_equivalence": true
}
